FoodName,ResourcesName,ResourcesCount,Step
콩나물국밥,콩나물#오징어#청양고추#배추김치#대파#다시마멸치 육수#밥#고춧가루#새우젓#맛술#다진마늘#후춧가루#,3줌#1마리#1개#1/2컵#1/4대#6컵#2공기#약간#1큰술#1큰술#1/2큰술#약간#,"콩나물은 깨끗이 씻어 다듬고, 배추김치는 속 양념을 털어내고 잘게 잘라주세요. 청양고추와 대파는 송송 잘라주세요#오징어는 내장을 제거하고 깨끗이 씻어 주세요. 냄비에 멸치다시마 육수를 넣고, 끓어오르면 오징어를 넣어 삶은 후 먹기 좋게 잘라주세요#오징어 삶은 육수에 콩나물을 넣어 3~5분 정도 끓이다가 건져내주세요. 콩나물 삶은 육수에 국물양념 재료를 넣어 밑간해주세요#그릇에 밥을 담고 삶은 콩나물을 올린 후 뜨거운 육수를 붓고 대파와 청양고추, 오징어, 김치, 고춧가루를 올려주세요#기호에 따라 새우젓을 가감해서 간을 맞춰주세요. 콩나물국밥을 뚝배기에 끓여 따뜻하게 드셔도 맛있답니다#"
해장 짬뽕,오징어#알새우#바지락#양파#청경채#표고버섯#목이버섯#죽순#당근#호박#배추#고추기름#다진마늘#다진생강#고춧가루#물#소금#치킨파우더#후춧가루#참기름#,½마리#6~8마리#한 줌#½개#2개#2개#1개#60g#약간#약간#약간#2큰술#1작은술#¼작은술#2큰술#3컵#½큰술#½작은술#약간#½작은술#,"바지락은 소금물에 담가 해감을 하고, 오징어는 한입 크기로 썰어 알새우와 함께 준비해 주세#양파, 당근, 호박, 배추는 가늘게 채 썰고, 죽순, 표고버섯은 편 썰어주세요. 목이버섯은 물에 담가 불린 뒤 청경채, 숙주와 함께 먹기 좋은 크기로 손질해 주세요#팬에 고추기름을 두르고 다진 마늘, 다진 생강을 볶아 향을 내주세요#숙주를 제외한 채소를 넣고 볶다가 고춧가루를 넣어 채소에 잘 흡수되도록 볶아주세요#순서 4에 물을 넣고 소금, 치킨파우더, 후춧가루를 넣어 간을 맞추고, 순서 1의 해물을 넣어 끓여주세요#육수가 끓어 오르면 숙주와 참기름을 넣어 완성해 주세요."
프라이드 치킨,닭봉(또는 닭 날개)#전분#베이킹파우더#식용유#소금#후춧가루#청주#,400g#50g#1작은술#3큰술#약간#약간#약간#,"닭봉은 깨끗이 씻어 소금, 후춧가루로 밑간하고 청주에 30분간 재워주세요#닭봉의 물기를 제거한 후, 베이킹 파우더와 전분을 섞은 가루를 고루 묻혀 주세요#구이 전용 팬에 닭봉을 올려 표면에 기름을 골고루 발라주세요#구이 전용 팬을 4단에 넣고 광파오븐 자동 요리 <에어프라이> 에서 <프라이드치킨> 0.4kg을 선택하여 튀겨 주세요#완성된 치킨을 접시에 담아 맛있게 즐겨주세요#"
돼지고기장조림,돼지고기(안심)#달걀#물#대파(파란부분)#양파#마늘#생강(마늘 두 쪽 크기)#통후추#월계수잎#물#간장#맛술#설탕#후춧가루#마른고추#,700g#6개#5컵#1대#1/2개#6쪽#1쪽#10알#2장#3컵#1/2컵#5큰술#2큰술#약간#1개#,"돼지고기는 6센치 길이로 썰어주세요. 냄비에 고기 삶는 물 재료를 넣고 끓이다가 국물이 끓으면 고기를 넣고 20분 정도 삶아 체에 건져주세요. (고기 삶은 물은 버려주세요#냄비에 달걀과 달걀이 잠길만큼 물을 넣고, 약간의 소금과 식초를 넣어 10분정도 삶은 후 찬물에 담갔다가 껍질을 벗겨주세요#냄비에 조림양념 재료를 넣고 끓으면 삶은 고기를 넣은 후 13~15분 정도 중약불에서 졸이다가 달걀을 넣어 간이 고루 배도록 5분 정도 더 끓이고 불을 꺼주세요#돼지고기 장조림을 결대로 먹기 좋게 찢고, 삶은 달갈도 먹기 좋은 크기로 잘라주세요.  (미리 찢어두지 않고, 먹을 때마다 고기 덩어리를 찢어주면 간이 세어지지 않게 보관할 수 있어요#"
돼지고기 간장구이,돼지고기(삼겹살)#색깔 야채#물#맛술#간장#올리고당#참기름#다진마늘#생강가루#후추#,400g#약간(생략 가능)#2큰술#2큰술#1큰술#1큰술#1큰술#1/2큰술#1/2작은술#약간#,"돼지고기를 먹기 좋은 크기로 썰어 주세요.  볼에 소스재료를 넣고 섞어주세요#색깔 야채를 잘라 꼬치에 꽂아주세요. 팬에 올리브유를 두른 후 야채꼬치를 넣고 약간의 소금, 후추를 뿌려 구워 주세요#달군 팬에 삼겹살을 넣고 3분정도 구운 후, 기름을 따라 내고 소스를 넣어 속까지 익히며 졸여주세요#접시에 돼지고기 간장구이를 담고, 구운 야채꼬치를 곁들여주세요. (기호에 따라 구운 야채꼬치에 발사믹드레싱을 곁들여 드셔도 좋답니다#"
돼지고기무조림,무#대파#돼지고기 목심#다시마육수#청주#후추#소금#고추장#고춧가루#올리고당#간장#다진마늘#,250g#10cm#300g#1.5컵#1큰술#약간#한꼬집#1큰술#1큰술#1큰술#2.5큰술#반큰술#,"양념장 재료들(고추장 1큰술, 고춧가루 1큰술, 올리고당 1큰술, 간장 2.5큰술, 다진마늘 반큰술)을 잘 섞어 준비해주세요#무는 0.5cm 두께로 나박썰어 주시고, 대파는 손가락 길이로 자른 후 세로로 2등분 해주세요#돼지고기는 먹기 좋은 크기로 썰어 밑간(청주1, 후추가루 약간, 소금 한꼬집)을 해 준비해 주세요#냄비에 무와 양념장 그리고 다시마육수 1.5컵을 넣어 중간불로 끓이다가 10분 정도 끓이다가 무가 반투명해지면 돼지고기를 넣고 중불에서 15분정도 끓여주세요.  (돼지고기가 어느정도 익으면 중간중간 무가 부서지지 않게 살살 저어주세요#돼지고기가 익고 국물이 자작하게 졸아들면 대파를 넣고 한소끔 더 끓여 완성해주세요#완성된 요리를 예쁜 그릇에 담아 맛있게 즐기세요#"
